{
	"$schema": "https://json-schema.org/draft/2020-12/schema",
	"title": "BookReservedEventV1",
	"type": "object",
	"additionalProperties": false,
	"properties": {
		"eventId": {
			"type": "string",
			"format": "uuid"
		},
		"eventType": {
			"type": "string",
			"const": "BOOK_RESERVED"
		},
		"producer": {
			"type": "string",
			"const": "book-service"
		},
		"aggregateId": {
			"type": "string"
		},
		"aggregateType": {
			"type": "string",
			"const": "BOOK"
		},
		"eventVersion": {
			"type": "integer"
		},
		"occurredAt": {
			"type": "string",
			"format": "date-time"
		},
		"schemaVersion": {
			"type": "integer",
			"const": 1
		},
		"payload": {
			"properties": {
				"isbn": {
					"type": "string"
				},
				"loanId": {
					"type": "string"
				},
				"userId": {
					"type": "string"
				}
			},
			"required": [
				"isbn",
				"loanId",
				"userId"
			]
		}
	},
	"required": [
		"eventId",
		"eventType",
		"producer",
		"aggregateId",
		"aggregateType",
		"eventVersion",
		"occurredAt",
		"schemaVersion",
		"payload"
	]
}